text,status,annotator1,annotator2
psychology lab at florida state university looking for parents and kids parenting is tough kids are stressed looking for helpful tips we are looking for children between the ages of and years old and their parents to participate in a study we will suggest some small behavioral changes that we think will help your child manage stress you will be paid for your time the study consists of either one or two depending on group assignment virtual study visits min via a zoom call with a member of our study team we will suggest some small simple changes to common behaviors for both you and your child to make over the next weeks that we think will help your child manage stress we will also ask you to fill out some online surveys at the end of the study you will receive a amazon gift card and we will send you a report form with your childs mental health symptom scores to find out more and to see if you are eligible click on the following link or call or email us today for more information phone email abhcnewhart,stress,stress,stress
it is crazy that in you white bitches will still paint your face black and still say nigger fucking disgusting,ethnicity_cb,ethnicity_cb,ethnicity_cb
sorry guys to all you guys i just argued with i got completely confused because i was going between different things arguing with different people i left reddit at one point and came back and had new messages so if a false accused you of saying something you didnt im sorry ok lets listen to this debate about this instead,non_suicide,non_suicide,non_suicide
i have nothingis it suicidal if you just really want to die i dont want to be the one to kill myself i just dont want to exist here anymore i have a child who is the only reason im hanging on so tight no matter how hard i try i have no friends due to having severe ptsd theres no one interested in me romantically for almost a decade i feel so worthless i have no job i wish i could just disappear in a cloud of smoke but i cant do that to her,suicide,suicide,suicide
i want to die nowits been rd time mom told me to die,suicide,suicide,suicide
my mom just had a fit because i did more than hour of screen time it is stupid i am only allowed to do non school screen time hour after school on weekdays and the whole day on friday and saturday but even then i get yelled at when i am on for more than hours this is so stupid bc i am and will be turning in a few months my parents are to years old and they can just get by with figuring out their phones my mom gets mad at me when i am playing xbox like i was doing drugsi dont do drugs it is just stupid,non_suicide,non_suicide,non_suicide
i bet you anything that soon theyre gonna make a movie called rich girl about a high schooler who gets bullied because her parents are the owners of a major corporation or some bullshit,age_cb,age_cb,age_cb
mankind must outlaw islam because it will never stop its hatred,religion_cb,religion_cb,religion_cb
i cant stop sweating the second i cough up phlegm there is immediately more and im like gagging on it my nose is stuffed and i have to actively try to breathe i feel so uncomfortable im losing my mind ive hit my breaking point and im just sobbing uncontrollably im stressing because ive already had to use sick time at work this year and its only the first week the house is covered in all of my sick germs and i dont have the strength to disinfect it the laundry is piling up and the house is messy i probably sound like an absolute baby right now but i cant do multiple days of being incapacitated i feel like shit and cant do anything i need to get done,stress,stress,stress
having no romantic relationships or prospects for one is eating away at me i am m and have never experienced anything of the romantic kind not even crushes i lost my teenage years due to isolation which is usually when people get introduced to this stuff ive never even had female friends except some cousins i live in a culture where arranged marriages are the norm im nearing the age when talk about marriage becomes more serious especially for women but i dont see myself ever getting married ill probably kms before it feels like i will miss out on this part of the human experience because im so insecure around women i saw a post that summarised how i feel perfectly gti have trouble talking to women in fact i cant even make eye contact with them especially if i find them even a little attractive im scared theyll think i like them and then theyll hate that someone as disgusting as me could like them i know that going into a relationship wont fix me but its so gut wrenching knowing that you dont have the skills or prospects that can make it possible its stopping me from even trying to make friends with women if they think i like them theyll probably be disgusted by me even though im scared to even let myself think that i might like someone i know that i should try to make friends with women first but im afraid they might label me a creep sensing my inexperience with talking to women let alone having female friends or a relationship its like i carry this secret with me like a badge of shame and i automatically defer any action about this to prevent myself from the humiliation that will result from it is there anyone out here who knows what this is like,personality_disorder,personality_disorder,personality_disorder
ae feel like this im and dont have a stunningly high body count it never used to bother me but once i hit my s and people i knew hit that phase of sleeping around and doing the casual relationship thing it just hooked into my brain i tried to do the whole hoe phase thing but im terrified of everything around being more intimate with someone making moves doing things right my own body just not being able to keep up the act ive got going and having to have someone see all of me you know and on paper i know its fine not everyone on earth is hoeing it up either side of the spectrum is fine but my brains really latched onto this as another thing that makes me different from everyone else and something people are going to judge me for like im not a person because no ones ever really wanted me amp every time someone brings it into conversation i just feel physically sick with how much of the biggest freak i feel like im sorry if this barely makes sense i just really needed to get this off my chest,personality_disorder,personality_disorder,personality_disorder
there is a word for your kind of people from rw a woke liberal first of all why idiots like you dont question the muslim extremists the same way and ask why they hate akshay amp why they dont hate khans its only got to be other way around eh,religion_cb,religion_cb,religion_cb
hair fall so ive posted here before regarding my hair loss issue i mentioned in my previous post that i have a very oily scalp and a lot of dandruff on my hair and as a result i have bald patches some people recommend me to see the doctor for second opinion so i visited another dermatologist today she was able to diagnose my problem she said i have a very severe hair loss at a very early age im only the problem she mentioned was androgenic alopecia she said normally this problem is caused because of genetics but since none of my family members are bald its probably due to an harmonal imbalance so im wondering is there anyone who suffered from a similar problem and how did they manage to recover their hair,anxiety,anxiety,anxiety
fucking hate already honestly im pissed off with this year and its only january,non_suicide,non_suicide,non_suicide
eid is getting closer oh god i feel so lazy to meet a big family im too lazy to ask a lot of questions its not okay im not comfortable im really worried fuck the life,anxiety,anxiety,anxiety
i have a story a week ago i talked to uadripofviolettea on a discord call they sound like a person,non_suicide,non_suicide,non_suicide
anyone else feel like bugs are crawling on them when theyre stressed out my last week has been very stressful i remember many months ago i was experiencing a similar level of stress and back then i used to feel like little bugs were crawling on my skin it gets worse when i think about it or if im going to sleep it came back because of the stress im going through now at least i think is this a normal repose to stress and does this happen to anyone else,anxiety,anxiety,anxiety
i honestly dont know what to do warning rant ahead and me being manic reaching out for something anything i am trying to dumb this down as much as i can to fit a general post so here it goes years ago i disowned my friends swore them off like they were a plague mainly to reinforce my manic state of i wasnt good enough for them because seriously i am not good enough my mood swings are prevalent my lack of funds from being manic are there my general lack of well being keeps me from hanging out so to speak i dont know what to do i miss them the whole friendship arc has worn itself out and i am a side character waiting to be in the story again so instead of that i cut things everythings and here i am alone and depressed years later reaching out to the interwebs to see what they have to say about my relationship issues i want to be a part of someones life i want to be a human again i want a friend i want to say sure i am ok to someone and actually mean it its hard and i hate crying and i hate that this is rant and this is how my life is and i hate it sorry thanks for reading i really dont know what to do,bipolar,personality_disorder,bipolar
your mom was uncalled for,gender_cb,gender_cb,gender_cb
stupid fucking nigger kid dancing in the middle of the street almost hit him fucking should have the little fuck hit my car dumb fucki,ethnicity_cb,ethnicity_cb,ethnicity_cb
chicken or the egg situation do i treat the physical symptoms panic attacks or the core issue childhood traumafeelings of inadequacy due to an array of weird circumstances i am a manager a manager with avoidant personality a manager who cant even say hi to her coworkers or ask for help a very necessary skill for a manager a manager who is visibly pushing down a panic attack each moment choking on words and shaky hands and youre too scared to ask to step down bc you already done so times i have no idea whether to tackle the somatic issue my panic attacksnervous system arousal or the core issue which is my feelings of not being worthy i feel like i am inherently toxic and cold i never say hi to anyone even though a manager should be approachable and amicable i will say i focused a bit on healing somaticallythe physical symptoms at least with somatic healing i dont lock down and go onto a full blown panic attack anymore where i am mute and shut down i know my limit i been a manager for a year now i been avoiding my family my career is falling apart and i have lost all my friends i need help but i feel like financially it is not possible i want to be medicated but ssris didnt do jack for me weed just bites you in the long run not sure if meds can ever really heal this i just want to stop having panic attacks but i know my core issuesinner monologue ans my unprocessed childhood trauma are what kick me into panic mode everyday panic mode makes me mute and silent which peoppe percieve negatively i go into work and feel inadequate for anyone ever seeing me at my lowest i avoid them out of fear of ridicule and the cycle continues,personality_disorder,personality_disorder,personality_disorder
can you explain what that refers to,gender_cb,non_suicide,non_suicide
international health insurance i know this may be a long shot but im moving abroad this summer and am shopping around for an international health insurance plan that will cover my psychiatric medications and a few psychiatrist visits a year does anyone have experience with this my work doesnt provide expat insurance and ill be primarily getting my healthcare in south africa but ill be living in madagascar im pretty sure i qualify as having a preexisting condition but i havent been in the hospital for three years and ive had consistent coverage for at least the last five years,bipolar,non_suicide,bipolar
why do people always want awards do they serve a purpose or,non_suicide,non_suicide,non_suicide
yes with a sprinkling of high school bully,age_cb,age_cb,age_cb
gtgo so,gender_cb,non_suicide,non_suicide
taking my sibling to a mental hospital help ive been posting this on multiple subreddits looking for help my sister f has multiple mental illnesses like bipolar idk which one depression and odd she spoke to me recently about feeling suicidal and expressed wanting to be admitted into a mental hospital she doesnt feel safe with herself and i cant do much to supervise her we both are left home alone for over a week due to our parents being out of town for work i myself am f and am able to drive around how should i go about this any advice appreciated,non_suicide,suicide,non_suicide
sleeping hours heart racing and chest pain hello all i have been on sick leave from work for months now tomorrow im starting slowly again hours throughout all january i have had this persistent restlessness i have been sleeping hours every night woken up and slept again for hours getting up at noon the past two weeks i have tried to get up at to match my work schedule now i only sleep hours and stay in bed trying to get in the last two hours it worries me that im still not sleeping through a full night im not sure if its stress or my hiatal hernia or my chronic neck pain that wakes me up but i wake up rather abruptly so im guessing stress sometimes i wake up with racing heart speaking of racing heart i started to get that randomly racing heart throughout the day i wonder if its because im starting work and im nervous about it i have social anxiety and im trying to fit into this new me first mindset im a big people pleaser but i have had to break with that habit now also i keep getting chest pain im not sure if its my hiatal hernia or if its stress idk what to do im feeling uneasy about not feeling better than i am after months,stress,anxiety,stress
bipolar depression and maois m i had early onset bp at diagnosed at and i have had no luck with meds thus far and am now onto maois my oral selegiline trial is just about up after two months the only time a medication ever affected my mood was when a low dose of lithium brought me out of a ten month depressive episode unfortunately my stability was short lived and i was launched back into a brutal episode in a weeks time this current depressive episode has lasted well over a year now the limited number of studies out there on bp depression treatment resistant depression and atypical depression treated with maois seem to have incredible results especially the ones using tranylcypromine i believe that will be the next drug i go on but im just looking for some personal experiences tips or insight right now im on oral selegiline therapeutic dose of lithium a dopamine agonist and a low dose of quetiapine for sleep because of the stimulatory effect of the maoi,bipolar,bipolar,bipolar
fax dawg i miss old fredo remeber the days when i could go back home from school and hop straight on yt to watch him flight and cash now hes gone hollywood wont exept the fact that hes in the wrong and would rather bully agent for speaking fax about the situation,age_cb,non_suicide,non_suicide
do you experience stress our personalized trial for stress management will provide eligible participants with a fitbit and guided mindfulness meditation yoga and brisk walking for easy inhome monitoring and health tracking this study will last weeks and participants will have the opportunity to win a weekly lottery pending their adherence to study procedures to learn more about and check eligibility for this study you can visit our website questions contact us personalizedtrials,stress,stress,stress
is that a rape joke or a gay joke i need to know if its okay to laugh,gender_cb,gender_cb,gender_cb
does childhood emotional neglect cause avoidant personality disorder not sure if anyone shared this here before its from but i thought it was an interesting read,personality_disorder,personality_disorder,
tw abuse sexual abuse homophobia mgeko mgeko fully made a gay ship that was abusive physically mentally and sexually turned it into a joke gave them a child and then made that child not only have a gross love for their father but also straight up rape him,gender_cb,gender_cb,gender_cb
no one wants to talk to you if youre or above its impossible to get a career with a degree and youre looked down upon for even criticizing anything thats wrong with how this generation is treatedi really hate how youre treated like shit if you try to dm or talk to any guy or girl online to try to establish any type of friendship i have no idea why youre treated like a pathetic human being for attempting to do so if youre in the college age group of i cant make any type of fucking friends no matter how hard i try i also hate how its nearly impossible to start a career in this type of generation even with a degree i know its a meme for stuff like this but its incredibly frustrating as someone who has to selfsustain and live alone thats an entirely different argument but im part of the group who are in debt and still make the same as someone who works at mcdonalds if i ever try to criticize that fact im bombarded with hateful comments whether it is on the inter or in real life its incredibly frustrating to be verbally stomped on for having a huge disadvantage at life social media has given us the option to be picky so therefore people dont like to make actual friends if they realize they have infinite options i dont want to make this some politicalphilosophical type of argument but its true i sincerely hate how being social works now now that the internet is a thing its hard its frustrating and i feel like its unfair for both sides its getting to the point where id rather not bother to battle for a liveable k a year wage for the next years of my life or battle to get a spouse that doesnt have dating apps at their disposable or any type of shit like that im sorry if i sound like a year father who hates technology or some shit like that i usually have reasoning when i post stuff especially if that stuff is my shitty opinions but im drunk and ive been experiencing it since i was im now and it hasnt gotten better i thought the advancement of technology would make people more social and open but its made things infinitely worse i explained in the worst way possible most likely but i feel like its just not tolerable for me anymore and id literally rather kill myself than deal with it i feel alone because ill see a comment or thread that mentions this every couple of months and they get raped with negative response i dont blame the people who post the negative response but there are people who are taking the fucking blunt edge of the sword from how people interact with society now that a supercomputer is in their pockets and have the freedom to just not talk to people,suicide,personality_disorder,suicide
always cracks me up how all these internet witches post themselves casting curse spellshexes on dumb trivial anecdotal shit like their ex bf intolerant parents or high school bully instead of trying to punish rapists pedophiles billionaires murderers or dirty cops lol,age_cb,gender_cb,non_suicide
what to do to get a psychiatrist i f had a psychiatrist in the hospital when i was admitted in december they put me on the aristada shot and sent me on my way i dont know how to get back in contact with them or how to get a new psychiatrist im in maryland i have been having tremors in my body and anhedonia i may have missed my second shot by a week i just want a psychiatrist to tell me what to do next i have a nurse practitioner for meds and a primary care physician who gave me the second shot thank you all for your help,bipolar,anxiety,bipolar
im aware i have problems when it comes to dating i get jealous paranoid and suspicious very easily i hate it about myself and hide it from my boyfriend very well take for example my bf we have each other on snapchat we maybe send one or two to each other a day its not like a thing we do but it could be i tried to send him more but it wasnt reciprocated yet i always see his snapchat score go up by like or more at a time i know i shouldnt snoop it just feeds my problems but i cant help it anyway i just get jealous that he snaps loads to other people but not me i dont know who it could be another girl he never sends a face pic to me but is he to others and if so why not me,stress,personality_disorder,anxiety
anyone take medication for health anxiety my health anxiety has become all consuming and im considering giving in and taking meds for it but im really worried about the side effects and not being able to drink smoke weed or have good sex also afraid of weight gainanyone have any advice or know of a good med to treat the ocd compulsions and over thinking about my health,anxiety,anxiety,anxiety
heath anxiety has a higher iq than einstein fact think about this health anxiety has the power to create symptoms out of thing airif you are thinking about them thats crazy me omg i think i might have a stroke health anxiety hold my beerlets make his face numb and arm numb that should make him panic me omg im right its happening,anxiety,anxiety,anxiety
neuroscience of bipolar i am a total hopless nerd what helps me probably the most with bipolar besides meds duh is understanding what the medications actually do i have binders full of detailed notes i take on different classes of psychopharmaceuticals its so fascinating how people with different brain chemistries react so differently to various meds for some reason the chemical perspective helps me understand it all so much better it also helps to explain it to normies ive found and with work ive done on emotional awareness it feels like i can tell when something is emotional versus caused by brain chemicals of course there is overlap after things like exercise sex caffeine anything that gets them neurotransmitters moving i feel hyper aware of my chemical state i can feel the the fall and the rise its just when i let my chemicals get so off balance that i get manic or depressed and then this logical view is fucked lol this was kind of random but it consumes a lot of my thoughts are there any other bipolar science nerds out there any thoughts or do you have certain scientific perspectives that help you understand this illness,bipolar,bipolar,bipolar
has anyone else have had this type of anxiety attack i have generalized anxiety but for the past couple of months due to the death of a loved one my health anxiety which was already present has skyrocketed anyway yesterday i started feeling anxious about something else than my health and then i had some coffee and started to feel sick like i was dizzy confused and nauseous health anxiety showed up again while i was walking home i was constantly thinking i was going to die right there in the street and i started crying i kept thinking i dont want to die in the street like this at least let me get home before i die i got home and my relatives tried to comfort me but i couldnt calm down i kept crying and feeling ill i even vomited a little anyway they helped me test my temperature and blood pressure and blood sugar and they all looked fine but i was not feeling fine at all eventually i did calm down but it felt like forever and i still feel physically bad so to say i have aches and pains all over all the time i feel like im and im only i dont get the normal raising heart beat thinking im having a heart attack kind of anxiety attacks so im not even sure if this is anxiety attack did any of you experience something similar,anxiety,anxiety,anxiety
too bad the gay community felt the need to make rape jokes about kesha and then belittle her success not a cute look,gender_cb,gender_cb,gender_cb
swollen lymph node rash dermatits and surprise another lymph node today what the fuck is going on with my body in october my perioral dermatitis flared up again after accidentally eating gluten it was around the time of the holidays and i was stressed due to major family issues december comes and i start to notice and itch on the back of my neck i also notice after i eat a heavy meal i have this mild pain on the left side under my rib cage spleen january the rash is a deep red unbearable itchy oozing and now paired with a swollen lymph node i change up my diet to vegan because i figured it was keto catching up to me that helped and the rash slooo got better but still lingers fast forward to this week the itch is mostly gone but the lymph node is still there albeit smaller yesterday i finally got my hair done because i couldnt previously with it so itchy i noticed a deep pimple on the opposing side of my scalp this morning i now have a swollen lymph node where the pimple is i also am hardly eatingnot very hungry and have managed to lose around lbs in a month but this could be due to vegan mostly raw diet of course i researched online and the worse is coming up lymphoma i am absolutely panicked ive been to a naturopath who put me on a multivitamin hormone rebalancing herbs probiotics and a liver cleanse help,anxiety,personality_disorder,anxiety
actually brought back the use of,ethnicity_cb,non_suicide,non_suicide
im almost donehonestly so much shit has been happening w my sister that i no longer have the desire to actually enjoy being home my sister has been on and off drugs for the past three years and shes starting to use yet again i want to cut and i want to see blood but yet again im so fucking scared,suicide,suicide,suicide
