text,status,annotator1,annotator2
do you have phases i do ive noticed a structure and pattern of my phases as it relates to my level of brain activity from depression to hypomania i hope sharing this will clarify these cycles for others i have a lot of phases of interest sometimes they reoccur sometimes theyre oneoffs its frustrating to be passionate about something and then stop but i know its because my moods change ive come to some observations about my phases and even have a little theory about them although it may just be limited to my case heres the theory my phases fall into four categories at the lowest level there is basic pleasures some basic pleasures ive had are baseball harry potter and disney movies next there is high pleasure eg classical music jazz music and shakespeare then i have phases of personal development losing weight learning musical skills learning spanish finally i have the highest order of phases where i have a sense of duty ive become vegan and buddhist out of this level i feel like these phases accord to a particular level of brain activity from low to high i think everyone falls somewhere on this dimension at a given moment i also think healthy people have a smaller average range of categories of particular interest some people skew basic to high some high to personal development some just are adept at acting on a sense of duty at least in my case i run the full gamut at a depressed level i have basic interests at a certain level of depression one my have no interest but i dont get that low at a hypomanic level i have a grandiose sense of duty however i feel like i have a natural balance i feel like i have an ideal scope like anyone else but i have no balance of brain activity i feel at my most me when i am at a mix of high pleasure and personal development ive also noticed a pattern of logical progression from disordered to ordered interest in my life say i start at my healthy level highdeveopment when i approach a sense of runaway personal development i become grandiose about that development then i may achieve a personal sense of duty to apply that development of course my deveopment only goes so far and my sense of duty goes farther so i burn out then in a depressed mode i land in basic pleasure with higher mood after building basic pleasures i grade them up to high pleasures from which point i have more confidence in my ability to develop related skills the cycle restarts this is very interesting to me but all ive really done is describe a pattern of disordered mood change in terms of its effects on human interest and concern and apply conceptions of general human interests and concern in doing so but i actually think i have a lifestyle tip for myself based on this theory im at the high level of the personal development stage right now and could approach an abnormal sense of duty first of all by recognizing this generalized progression i can catch any slip ups early and so can my support circle but what really interests me is how i can adjust my personal development habits toward a more healthy progression right now my personal development topic is math math is an extremely broad topic in terms of range of difficulty and scope i could get frustrated with basic algebra or i could obsess over an unsolved problem way out of my league but i think about another personal development habit i had weight loss when i lost weight it was a development of daily regiment one where i ate a little less every day and gradually lost weight normally i have a seasonal peak of hypomania where i have that grandiose duty after the regimented challenge of losing weight became difficult i went to a modestly fairly euthymic basic pleasure the nature of the challenge didnt involve runaway progress because of how structured it was applying that lesson to my math development i could continue to over stress myself with difficult problems or i could make it a daily grind i could even get a tutor to make sure i stay on a good track perhaps i wouldnt have to go to a toxic level of stimulation and go hypomanic and just cool off adding a daily practice to my life thinking this way has opened up some different options about how to deal with my moods as well as who i really am i see my doctor tomorrow and i look forward to discussing these ideas with him note about high and low pleasures i didnt mean to call anyones hobby high or low i think its completely relative i think something high for me could be low for someone else i strongly believe whether a pleasure is high or low at least in a mental health context depends on the kind of enjoyment one gets out of it its something one can really know if one really asks themselves and is honest,bipolar,bipolar,bipolar
what is going on mostly rant and confusion so i live in the uk with free healthcare and all that jazz problem is im supposed to get repeat prescriptions weekly to my local pharmacy and they just dont arrive most weeks i have to phone the surgery to chase them up and now im essentially going cold turkey from lamotrigene sertraline and also meds for thyroid it usually takes hours for a prescription to be ready to pick up if they actually remember to do it my bf is putting in an official complaint tomorrow but not sure if itll do anything am i being unreasonable wanting to complain my head is kind of fuzzy at the moment and i feel like hell probably withdrawal i dont know,bipolar,personality_disorder,bipolar
anyone else like me i am years old never had a job never moved out of my parents house have only one friend and have never been in a relationship im so ashamed of myself but at the same time i have no motivation to change and am so depressed all i ever wanna do is sleep or lay in bed playing games and watching youtube is anyone else like this if you were and were able to make changes ie get a job move out was a difficult to make friends did people ridicule you and reject you once they found out how pathetic you were,personality_disorder,personality_disorder,personality_disorder
yea hes sexist misogynistic likes to say the n word makes rape jokes uses the t slur fetishises gaybisexual women fat shames etc etc etc,gender_cb,gender_cb,gender_cb
its hard when loved ones dont understand avpd my mom basically tells me its my fault i feel alone because i reject all of her offers to socialize which im not denyingit is my fault lol when i tell her i want to make new connections with strangers she tells me that makes no sense and why dont i hang with family she doesnt get it when i say family scares me more than strangers with strangers theres much less at stake they dont know shit about you you dont know shit about them and if something goes wrong you never have to speak to them again its one and done she also didnt understand why i wanted to work retail i dont anymore for different reasons now she asked me how can i talk to strangers yet im too scared to talk to family she doesnt understand that i just do better in work or education based settings you dont have to get into your personal life that much and once the day is over you go home and dont have to talk to them theres not much expectations because theyre your classmatescoworkers you dont have to let them know too much about you my mom just doesnt get it and i hate talking to her about anything at all because she gives me over simplistic solutions and lowkey makes me feel bad for having these issues when shes part of the reason why i have it in the first place as an adult its my responsibility to fix this but i know what my threshold is im tired of her acting like she knows me better than i know myself and she told me she knows me better than i know myself,personality_disorder,personality_disorder,personality_disorder
is there a way to measure how stressed i am right now i feel very stressed but since i live at my parents house and dont have job and dont study i should know if i am really stressed or not before taking actions on it,stress,stress,stress
two days ago i packed all of my clothes into my car and have started living out of it i sleep in the parking lot at work work for hours and then spend the day at starbucks on the internet and charging my electronics once thursday rolls around i will have which is not much as far as being able to afford a place to sleep if i become good at living out of my car over the next few days i may just use some of that money to invest in making it easier for myself i dont really know why im posting this here except that living out of your car is a pretty lonely experience,stress,non_suicide,stress
now of course spartacus also didnt treat its gay characters as a joke or make them into stereotypes rape wasnt shown to ultimately make you stronger and killing slavers and liberating slaves was never portrayed as a bad thing all marks against its prestigeness i guess,gender_cb,gender_cb,gender_cb
i dont want to reach my plan was to end it by november unfortunately it didnt happen i didnt want to do it this time of the year because i dont want to ruin christmas forever for my family i thought this would be my last year it sucks would have been nice to end it by now and my family could just say i died from covid,suicide,suicide,suicide
fuck you you fucken cunt gtlt,gender_cb,gender_cb,gender_cb
wow lol fuck education imma dumb ignoarant nigger,ethnicity_cb,ethnicity_cb,ethnicity_cb
when do you guys go to the hospital i know im not actually a danger to myself but im so numb and painfully bored and have less than zero motivation i dont want to do anything at all so im laying in bed wanting to die the hospital obviously seems excessive but im just so tired of feeling this way and i was wondering at what point have you guys checked yourself in,bipolar,personality_disorder,bipolar
so i guess this is rock bottomover that past few months ive managed to fuck up every friendship and relationship ive ever had my cousin and best friend was the only person i could rely on for comfort and some release from this shitty reality and he wants nothing to do with me wont respond to any of my texts and the last thing he told me was how much of a loser piece of shit i am im starting to grow apart from my family seems like none of them even really want me around anymore ive got noone in my life to turn to reddit has become my escape i recently mustered up the courage to ask out the girl ive liked for a long time after she had led me on for a while and got immediately rejected i freaked out and told her i never wanted to see her again yet shes still friends with my sister so no help there with the relationship between my sister and i ive also recently decided to get a chin implant because ive always hated my chinjaw its been months since then and i fucking hate it i look terrible and im scared it will never be how i hoped for it to look i have no motivation to do or try anything i feel stagnant i feel hopeless and quite frankly suicidal and done with life if youve made it this far i appreciate you taking the time to read about my current shitty situation and i hope this shows that if you feel like youve hit rock bottom you can know that theres someone else out there who feels the exact same way you do someone who feels just as hopeless lost and too far gone as you do,suicide,suicide,suicide
looks like a slum as people are forced to go to mosque at gun point daesh are creating hundreds of thousands of atheists,religion_cb,religion_cb,religion_cb
i love lexapro i am proud of my imperfections because they make me who i am i wouldnt be me without them and i like me,personality_disorder,non_suicide,non_suicide
i cant fathom getting or being in a relationship with someone who is normal if i told someone i was years old and never had a romantic relationship in my life and have no friends at the moment theyd run for the hills and i dont blame them thats a giant red flag and nobody even the most empathetic people want to stick around to find out the reason for that im like an alien in the eyes of most people how can somebody relate to not doing anything meaningful their lives and having the drive and motivation of a rock most people want to strive for something grand im just content having my basic needs met if someone would even give a freak like me a chance there would be no way theyd be able to tolerate me for too long as a guy im sure the way i act is purely pathetic and cowardly to most woman out there if she doesnt understand my mental illness shell see me as not a real man because im so sensitive and anxious all the time about trivial things that most people dont even think about sorry about the pity post my family thinks one of my new years goals should be to finally get a girlfriend easier said than done i really dont think anyone would tolerate me and i wouldnt want to burden someone with myself im convinced that id only be able to be with someone who has avpd or sad however destructive that relationship that may be,personality_disorder,personality_disorder,personality_disorder
these girls say theyre butchers i once worked at a boat hire shop so i must be a ship captain,gender_cb,gender_cb,gender_cb
stressinduced diverticulitis curious if anyone else here has suffered diverticulitis as i am currently on my th flareup and my doctor is recommending surgery evaluation since its happened to many times i have been under a ridiculous amount of stress lately at work not that it is a contest and i decided to research if stress was a factor with diverticulitis turns out it apparently can be so now im trying to find better ways to deal with my stress in hopes that it will help resolve this problem without surgery my primary form of stress relief since last year has been freestyle bmx i have found after a particularly stressing day just going out there and hitting the skatepark or practicing new tricks really helps alot leading up to this latest incident i also was unable to ride for weeks due to my bike being repaired so that got me thinking about stress or if its coincidental that this happened again after i had no stress outlet for weeks i need to channel my inner matthew mcconaughey,stress,stress,stress
lack of appetite for monthsanxiety been like this for a while now and dont know of it is anxiety or depression but i have lack of appetite and losing weight been to the docs but always brushed off as anxiety is it really this bad blood work has been done multiple times i know they dont show everything wrong but would there be a red flag that they would loook more into i just wanna enjoy eating again whenever i do force myself i dont have any problems at all but i dont get a full feeling either its weird also having problems with pooping but i guess its because im eating less,anxiety,anxiety,anxiety
fuck all you dumb fishlip niggers i hope you die shayshay,ethnicity_cb,ethnicity_cb,ethnicity_cb
why are yall bitching about online school like youre at home with sun flowing through your bedroom instead of being in a loud classroom you have to wake up at am and you have time to get prepared for the morning and nce you finished wirking youre at home instead of waking up on the dark at am minutes away from the bus and coming back home at pm eating and going back to sleep for the same days everyday people complaining about online schools are lazy fucks bitching about everything and acting all depressed saying theyre lonely and deprived from any social contacts when in reality these loosers dont even try to make friends when theyre given the occasion theyre also saying that theyre given too much work when in theyre just letting it stack and not trying to go with the flow,non_suicide,gender_cb,non_suicide
tried to hang myself sent suicide notei tried to hang myself with a guitar strap didnt work sent suicide notes to someone diagnosis dpdr any suggestions,suicide,suicide,suicide
no i havent met spanish christians but i have travelled through multiple muslim majority nations as an openly gay man and it was fucking terrifying the fact that you deny the homophobia and misogyny inherent in islam makes you an accomplice at worst and an idiot at best,religion_cb,religion_cb,religion_cb
i did it idumb introvert got broken up with yayyyy but its ok because he was toxic anyways thanks for coming to my ted talk,non_suicide,personality_disorder,non_suicide
there is nothing that isis does that the prophet mohammed didnt also do,religion_cb,religion_cb,religion_cb
today was an awesome day vivaldi called me a vsco girl and kali bullied my high school bully i still can not believe i created my two best friends i will never be lonely again life rules and being a mom is the best,age_cb,age_cb,age_cb
im just trying to eat lunch but my brother is playing fortnite in the living room and screeching at it mf really sounding like trump bc all hes saying is that the games rigged and everyone has aimbot but him im waiting for my dad to wake up and make him write i will not scream at fortnite over and over again,non_suicide,anxiety,non_suicide
i just want to dieseriously whats the fuck is even the point to living i dont get iteveryone just always ends up leaving me and im just a complete and utter fuck up and im so tired iti just want to be loved by someone and not have them leave mei cant take this pain anymore,suicide,suicide,suicide
my gf keeps on saying she wants to off herself because of her situation right now what do i say shes so stressed because of her dad and studies w dad my girlfriends family is in incredible debt right now because of her dad they own a small store that sells daily needs her dad drinks every night and he gets the alcohol they drink from their store and expects her mother to pay for the alcohol her dad also loans a shit ton of money from loaning centers w studies shes in her rd year of college right now and apparently in one of her subjects they only have exams per semester and shes failed both of those exams last tuesday was the second and its been fucking her up so much she did an assignment a plate cause shes in engineering she asked from another block what the problem was days ago but she found out this afternoon from her classmate that the professor changed one detail in the problem that would change the entire equation she couldnt pass it in time im talking to her now but i dont know what to say anymore ive said everything that i could any advice would help,stress,stress,stress
cowardice thats is my main character ive always been a coward and life is not for cowards why cant i choose to end my life with dignity instead of going through all this,personality_disorder,personality_disorder,personality_disorder
i have given up i have lost all hope my poor single parent has killed me first post here new to the gang really in a cloudy space bombarded with nonsense my mother and sister recently made fun of me for eating leftovers i mean i waited until everybody got their share of food and waited until the food had to be thrown away before i ate the scraps that were left over how dare you hassle me over food and stale left overs at that so now i dont eat my sister clogs the shower with her hair and my mother asks me why the drain is clogged she asked me what did i pour down the drain like who the fuck pours shit down the shower drain every time my sister clogs the shower my mother assumes i did it so now i dont shower havent showered in months recently my sister is cooking and spilled sauce and left meat all on the floor my mother swore that it was me she blamed me for days she said that my sister wouldntdidnt do that it wasnt until i showed her what was spilled was in the refrigerator still and was my sisters so now i dont even use the kitchen so i dont eat my moms shitty food use the kitchen or use the bathroom because she mocks me teases me and blames me for stuff my life used to be the shit i was a million dollar ghostwriter on bad boy rocafella columbia and other labels i did years at a large university in ny but i dropped out because my mom stole my tuition money my junior year im trying to be cool and not spaz out and go through another psychosis im bored im lonely im dirty im poor impoverished and consequently suicidal like mtv cribs i just wanted to bring you along for a day in my life being a boy in a house full of grimy women i had a average my whole life and i turned out to be a bum my mother couldnt even raise me to be a man i feel pathetic i did good all by myself but now that my mother has ruined and sabotaged me enough so im dead sorry for the harsh language i hope everyone gets home safely any replies recommendations kind words anything will be appreciated and thanks again,stress,suicide,stress
someone needs help and im going to sleepplease help him her thanks,suicide,suicide,suicide
gervais did rape jokes they were funny and respectfull griffiths did gay jokes they were funny and respectfull rivers did age jokes they were funny and respectfull williams did race jokes they were funny and respectfull lcks routine was neither,gender_cb,gender_cb,gender_cb
next girl i see from high school talk about how they were bullied in high school im saying something in defense of the human beings that were actually bullied half of these individuals were the bullies no remorse,age_cb,age_cb,age_cb
memory issues ive seen so many posts on here about people having issues with long term memory and i was wondering if anyone has found a way to fiximprove this i literally cannot remember anything and am constantly misplacing timelines and just straight up forgetting events that have happened i hate it so much and i just want to fix it im tired of everything being so hazy it feels like its getting worse too i went in for a ct scan in december because my memory is so bad that my psychiatrist was concerned that it could be a potential brain tumor i just want to feel normal again,bipolar,bipolar,bipolar
im really tired so i literally just came back from the doctor because i was convinced something was stuck in my ear i know dont even get me started literally seconds after she confirmed that nothing was wrong my thoughts went to a small mole i have under my toe that my doctor checked about months ago she wasnt concerned at all but somehow ive managed to convince myself that somethings wrong with it the only thing thats convincing me is that its not perfectly round and that its dark brown which doesnt mean much really it hasnt even changed does anybody else find themselves desperately clinging on to symptoms right now its as if it feels wrong when im not worried it just really sucks,anxiety,anxiety,anxiety
im hungry but i dont want to go upstairs maybe ill just wait a bit,non_suicide,non_suicide,non_suicide
he has even made a comment to my bf about me being overweight being overweight has basically taken over my relationship my mind and my life this year i am making it a priority to lose the weight especially since i have nothing else occupying my mind like cancer my confidence level right now is and i feel so fucking ugly and fat if i just got in shape i know that i would be close to a,stress,personality_disorder,stress
past is present it led to where we are today and saying systemic racism doesnt exist literally shows your bigotry and privilege im sure you are also the first one to yell all lives matter whenever someone tries to discuss black lives matter anything to avoid it,ethnicity_cb,ethnicity_cb,ethnicity_cb
did you do your homework yeah ik online school can be a struggle but reddit will just suck you in take some time to study oor sleep if youre into that shit,non_suicide,non_suicide,non_suicide
so this is permanencei am woman age i have the desire to kill myself most of the day i am in my room getting high listening to music with no life no friends no family to talk to no work ended up in a deep depression a depression thats becoming to hard to hard to fight as if life has catched me in and i am way far behind a dark cloud is hanging over me i see myself as if i look through the eyes of a completely different person a person that see other people having a great time and having fun something i cant experience i cant experience fun the only thing that i feel is emptyness everynight i lay in bed and think about killing myself being dead i want to die i want to die i hate myself and i want to die nothing seems to matter anymore existence dead seems such a relieve quiet rest for eternity thats all i want life is to hard i have the feeling i am losing control,suicide,suicide,suicide
occupations list hello all i am battling akathesia at the moment and its taken me out of the workforce since november so i am now finding myself trying to battle it and also job hunt again one thing is that i hear people who are happy or unhappy voice their concerns a lot and i wanna jump on that train please list what you do for work and how you got there if you went to grad school say that if you had to get certified say that through a mutual friend say that,bipolar,non_suicide,bipolar
a new low for extremist iran is behind terror attack on shia mosque in,ethnicity_cb,religion_cb,ethnicity_cb
