text,status,annotator1,annotator2
i hate this reality everybody gives you a set of peramitors that you have to follow i get the big ones like dont rape murder steal bla bla bla but i dont get the smaller ones like dont cuss at your parents dont talk to loudly in public and many more and when you break one of these peramitors youre an outcast a criminal or a delinquent like me i just want to go into a dark room and shut everyone and everything out leave this reality behind and start a new one in my head that i control one where i can make the rules and decide what goes and doesnt one where humans animal and monsters alike can run around in a field of wheat or snow and not have to worry about a man walking up to them and blowing their brains out im tired of my family even though they arent toxic i hate the rules they have for me them talking to me and them caring about me dont they realize that the second i turn im not gonna give a shit about them why care about me if im not your kid why tell me all these fantasies that when we grow up we can maintain our friendships and have a great life emotionally and financially thats all fucking bullshit the second you hit highschool your friends dont serve a purpose at least thats the way i see it they are only people who slow you down your always told love is something you would do anything for youd kill for it youd give up your hopes and dreams for it but why why get a girlfriend for months who wants me to stay home when i would rather be a pilot for the usaf and happily die for my country fuck this reality if only i could replace it,non_suicide,personality_disorder,non_suicide
i guess today is national make gay jokesrape jokesi hate my wife jokes huh,gender_cb,gender_cb,gender_cb
new to risperdal do side effects subside im years old and was just diagnosed with bipolar type ii after prozac treating what they thought was depression sent me into a psychotic episode i was diagnosed with major depression amp generalized anxiety disorder at years old and just coasted on wellbutrin xl amp celexa until college then cut back to just wellbutrin xl in college until about a month ago i havent been depressed in at least a year but my anxiety has been out of control for many years the psychiatrist at the hospital was convinced the anxiety is a manifestation of hypomania and put me in risperdal mg twice a day i started it days ago and take it in additional to wellbutrin anyway enough about that my dose of risperdal is very low at mg a day and i still feel like a metaphorical zombie my brain is in a fog and i can barely stay awake im terrified of driving or working like this no general anxiety though thankfully i dont notice an increase in appetite either if you took risperdal did early symptoms go away after a while im just a little disturbed because its such a low dose and im already feeling like this the psychiatrist eventually wants to maybe bump me up to mg a day but if thats gonna make me feel even more like this i dont know if id be able to function im willing to stick with it if itll make my outofcontrol anxiety manageable at some point but im a bit skeptical if these side effects will continue as long as im on it,bipolar,bipolar,bipolar
i have similarities to rick astley i am ginger private reasons i cant tell,non_suicide,non_suicide,non_suicide
dems the party that kicked god to the curb but defends islam,religion_cb,religion_cb,religion_cb
dealing with als anxiety hi all this is my first post here but ive found the content extremely helpful as ive tried to manage my anxiety about als for the last week or so im a year old male in what i would consider very good health but since an incident weeks ago ive had extreme and debilitating health anxiety about having terminal cancer or als it started with numbness and tingling in my feet legs and eventually groin after watching a live basketball game in an uncomfortable chair i was already worried due to a urinary issue that started a week before this incident and has since resolved so i think i was a bit more on edge than normal anyway since this event ive had the perception of weakness in my body and the feeling comes and goes i dont have any evidence of actual weakness but when i think about lifting weights i dont think i can lift the same amount that im used to as a result im compelled to do strength tests with objects around me its a nightmare to make matters worse my thumb on my left hand had been twitching slightly for days now i can see a visible pulsation in my hand near the base of my thumb and hand im thinking my thumb may be twitching as a result of whatever arteryvein is there but im really scared ive gone to a few doctors over the last few weeks urologist and nurse practitoner and they havent flagged anything as a cause for concern im set to see my pcp on friday als fear is consuming my life can anyone help,anxiety,anxiety,anxiety
but no muslims stop any other muslims from carrying out their genocide they only aid and applaud them,religion_cb,religion_cb,religion_cb
hedonistic im so insanely hedonistic i cant do anything that doesnt give me instant gratification i quit every single thing in life that didnt give me instant pleasure i cant see myself ever achieving things that i want from life it feels like i would need to become a completely different person if i wanted to get what i want from life theres times when i think that maybe the best thing i could do is to accept myself as im and that i should just give up on trying to change things,personality_disorder,personality_disorder,personality_disorder
signs of stability guys i think im stabilizing i sat down and painted for hours yesterday and wasnt too restless to sit still i am turning the music down to a reasonable volume instead of blasting it im cleaning i am having thoughts of budgets and time management i feel like a different person with both feet on planet earth what are signs you are starting to do well wishing you all stability and happiness,bipolar,non_suicide,bipolar
midday coffee i should give it up right because im kind of agitated amped up now and i should already be asleep ideas for helping to calm down go to sleep tell me all about your experiences with caffeine and coffee fellow bipolar people one of the trains of thought running through my head right now is in my own language gibberish which makes me think maybe i cant blame this all on coffee lmao,bipolar,non_suicide,bipolar
i dont think he likes me anymore oh btw fuck that niger i know that was a subtweet dumb cunt,ethnicity_cb,ethnicity_cb,ethnicity_cb
ive done horrible things and i think i should kill myselfive done some horrible things in my past every now and again what ive done will come back to haunt me do i even deserve to live or should i just end it all would that be the good thing to do these thoughts dont ever leave me for long something will always come up to remind me of what i did i was about or but i still knew better and feel like i dont deserve to live,suicide,suicide,suicide
i cant keep up with anything and its taking both a physical and mental toll on me everything just a jumbled mess right now and i cant handle it my cousin passing school being bullied for both my autism and abilities my job my diabetes my parents my friends every single thing in my life is ruining me and i dont know how to deal with it ive tried everything i dont know anymore im only and i dont have hope for anything its just all too much,stress,personality_disorder,stress
alcohol is numbing my guilt of committing suicidei have a dependence on alcohol however i havent been drinking it every day or every weeks but once in a couple of months that may not seem like much but we i do drink it i feel dependent on it recently something horrible happened and i feel so happy to be somewhat drunk now i know im not a harm to myself but the thought of dying while in this mental state makes it seem so much easier to doi feel free somewhat and happyi plan to be drinking for awhile possibly staying up for days at the max to avoid having ptsd dreamsthese are usually triggered by stress and i fear going to sleep so thats why im staying up but i dont want to feel crappy while staying up for once in my life i feel no guilt about killing myself no guilt about what my family may think because i feel like they would be okay etc i think im going to drink daily i know this isnt healthy but i feel like this is the only way to feel alright and just okay,suicide,suicide,suicide
how do i stop losing track of all the things i have to do this week i missed my appointment with a doctor i had it noted in my planner on the same day but also the day before and still i managed to forget and miss it i know this happened because there are just so many things on my planner and in my head that i cant keep track and get it all done anymore but i dont have a job i dont study i dont workout i dont do any unnecessary things im only trying to survive and work on my health and my daily life is still too much stress if i was still in uni with all that homework i would be dead rn what stresses me out no big things but alot of small things combined with my extremely low energy for example i have alot of emotional stress because of my mental issues being unhappy with my life friendships not going well gf broke up with me a year ago and still not over it so that was emotional stress now im also stressed out because i have so many things to get done while not having energy for it for example making therapist appointments doctors too fixing my phone changing my email on accounts calling back the hospital trying to fix my bedtime all those tiny things that cant be avoided they still stress me out i only gave a few examples here but my days are full of many tiny tasks that i have to get done but i dont have energy motivation i cant keep track of my shit i forget about everything even if it was noted in my phone which i check multiple times a day and if i dont forget im either too tired or not motivated to get shit done,stress,stress,stress
remember when people were freaking out about the cuties trailer i miss those simple days,non_suicide,non_suicide,non_suicide
if you had sex with a clone of yourself would that be considered incest or masturbation i think its masturbation since youre biologically the same thing,non_suicide,gender_cb,non_suicide
are you kidding me this kid deserves every penny of what he got cnn and the bullies that work there need to learn a lesson for their blatant lies against a young high school man the wa post and cnn wouldnt know truthful reporting if you hit them over the head with it,age_cb,age_cb,age_cb
your goat is calling you terrorist she is horny,religion_cb,religion_cb,religion_cb
i am now alone at night at a sketchy trainstation and my anxiety is over the roof i feel like i cant handle this i f was traveling home from uni for weekend my jurney consist of long inernationl train and then a minute with small train my international train was delayed and i missed my conection now i am stuck at a sketchy train station with almoust noone here the second i stepped out of train i wanted to cry out of anxiety and fear i am alone in the waiting room with only one man and thats all for the minutes i am here i am shaking and trying not to cry what doesnt help is the fact that like this morning at a bus stop drunk mane came to me saind hi cutie and jokingly pocked me to my lower atomach i couldnt react fast enough to stoped that but he just walked away a random drunk men walked in the station now bought a ticket and then started to talk random stuff and left i am just so scared i have to sit here alone for another hour and i feel like i am going to crumble down i dont know what to do there is not any safe space i can go and wait i feel like throwing up and thats not normal sorry for my english it is not my first language and i have also realy shaky hans now,anxiety,anxiety,anxiety
would you suck dick for a chickfila sandwich word word word word word word word word word word word word word word word word word word word word word word word word word word word word word word word word word word word word word word word word word word word word word word word word word word word,non_suicide,gender_cb,gender_cb
behind your online there is a heart that is anxiously waiting to hear from you,anxiety,non_suicide,anxiety
dae feel a sense of rushurgency over everything and cant relax it feels like my entire day is urgent even if tasks arent urgent like say just housework and im bumbling about it feels suddenly really important and urgent and that makes me feel overwhelmed its almost like i make things a higher priority than they are and its difficult to reshape that thought process tips everything in my life feels like its rushing even when i have plenty of time,anxiety,anxiety,anxiety
dear all girls from high school who bullied me and then became nurses this is the candidate for you,age_cb,age_cb,age_cb
can tension headaches kill brain cells or cause brain damage ive been studying a ton recently once when i was studying i got a bad tension headache ever since then ive been worried that it killed my brain cells or caused damage and its driving me crazy,anxiety,personality_disorder,anxiety
you cant help but laugh when muslim teens mostly girls are trying to get a bfgf and then claim to be a believer in islam theres no such thing as bfgf in islam either youre married or youre not its a grave sin idiots,religion_cb,religion_cb,religion_cb
you dumb bitch black isnt a colour its a shade as is white muslim is a religion not a skin colour,ethnicity_cb,ethnicity_cb,ethnicity_cb
you r disagreeing wit all of this bcs uv neva exprncd racism rm a coloured prsn while u are blackthis is no diffrnt thn a white person denying hs family amp friends r nt racist colored ppl who have a lived experience of it because heshe has never exprienced racism from whites,ethnicity_cb,ethnicity_cb,ethnicity_cb
ffs a can opener is too technical for the skanky hoes,gender_cb,gender_cb,gender_cb
vindictive little high school bully is now sheriff,age_cb,age_cb,age_cb
my friends know i am suicidalthey all know now that i am suicidal they know my story half of it but i dont know no matter how much i want to be with them i always feel that they didnt want to be with me as if like i am alone even if im with them is it normal or im just overreacting things like always ive been eager to kill myself but i dont have the strength to do it,suicide,suicide,suicide
i cant tell if im jealous of other people i think i like my life when i am alone i am happy to be by myself do my work and my chores and i have hobbies that bring me joy but it feels as if it all comes crashing down and a heavy sense of depression and grief hangs over me as soon as im reminded that other people do fun things together i dont want to join them because most of the time having fun with friends isnt actually fun for me but the feeling persists and can go on for days i know its silly to feel resentful of these other people and it makes me resentful towards myself as well i just want to make it stop ex driving my sister who is still in high school to hang out with her friends or go on dates im only a year older than her and afterwards suddenly my existence is in a different focus and i remember that objectively it is very dreary that the most exciting thing i have done in a month is watching my spinach sprouts grow,personality_disorder,anxiety,personality_disorder
as a guy i wish i was raised by my father instead of my mother i just had to get this off my chest its not that my father is perfect and while my mother has improved throughout childhood i was subject to feminization neuroticism and hysteria by my mother and sisters it is only now that i realize this just venting sorry,personality_disorder,personality_disorder,personality_disorder
stop claiming these bitches you niggas look stupid,ethnicity_cb,ethnicity_cb,ethnicity_cb
scared to dieim tired of being alive but im too scared of the idea of pain during death i dont believe in anything after and i feel like im postponing the inevitable meds arent helping anymore and i dont see why i couldnt have just gone through with it years ago when i was more manicinclined i keep lightly toying with hanging but im scared it wont go through im so tired of fighting my head im sorry for rambling i wish i could be euthanised the only solace everyone around me has is im too fucking stupidly scared to actually do anything,suicide,suicide,suicide
meds effecting my sex life i think the medicine im on is starting to effect mine and my wifes sex life im on mg of lithium mg of latuda mg of trazadone mg if wellbutrin does anyone have any tips or suggestions i see my pdoc in weeks,bipolar,bipolar,bipolar
follow me back nigger i did dumb fuck,ethnicity_cb,ethnicity_cb,ethnicity_cb
hopelessnesstoo lateness is there a point where one can consider it too late to do anything too late to try too late to get treatment too late for anything and everything too old or if someone is too badly off ive seen some people around reddit and the net refer to failed lives ive recently made posts and tried to look around reddit for people in a similar situation as mine and there seems to be nobody and the only conclusion i can draw is that my circumstances are too uniquely screwed up and avpd along with other issues all intersecting have led to a completely failed life and me as a broken mess growing up or developing avpd in a family full of npd didnt help most subs seem to skew younger which has me think that everybody either resolved their issues as they grew up or are no longer alive how has anybody dealt with utter despair and hopelessness feeling too old and that its too late to change anything satisfactorily does anyone have other issuesdiagnoses that mix with avpd to just make things impossible,personality_disorder,bipolar,personality_disorder
ahh manu well said just cook good food and youll be ok simples back in ya box bitch kat,gender_cb,gender_cb,gender_cb
did i tear my knee ligament again or am i making it up right so a year and a half agomaybe two years agoi tore my right knee ligament while playing an sportand after half a year i recovered fully and eventually starting being active again then i tore it again last summerand once again got out of rehab a few months after however one evening when i was standing up i felt the same sudden pop and pain i felt last timei tore it again im now done with my third round of therapyand i thought everything was fine but just now i had to move quickly and then i felt a sudden pinching pain its not quite the pain ive felt before but i cant see it as a dumb coincidence of course this could also be the case that i just strained it and things will get better as the day progresses and i move more but idk it should also be noted that im overweight by pounds years old,anxiety,anxiety,anxiety
if i was a bully in high school how come the girl i bullied in high school is giving me such thoughtful advice about processing the death of a parent,age_cb,age_cb,age_cb
i was completely on my own by when she felt the cuts on my wrists in the dark on night she asked if i was cutting i said no and she never said anything again i could go on and on i think she truly believes that because i am an adult now that all the screw ups all the pain i have been through is my own fault,stress,suicide,suicide
so someone just told me that lying communists who oppose equality can you believe people this bs,gender_cb,gender_cb,gender_cb
feeling i dont belong when im alone or doing my own thing i dont feel alone so much im used to being alone and doing my own thing and here and there i communicate with people thats okay but when im suppised to be part of a group i start to feel inferior to others and that i dont belong everyone else is interacting with each other but somehow i am left outside the group the school and uni were propably the worst because you are alone amongst everybody else everyday in my current work everything is okay because i work from home and i dont see the others interacting all the time i just pretend that everyone else is doing their work alone same as me but now we have this group work at my work and now i feel alone again we should be interacting with each other but im not interacting with anyone in meetings i hear how everyone else has been working with each other except for me group work makes me feel so alone,personality_disorder,personality_disorder,personality_disorder
this campaign is beyond sexist so women dont rape now apparently only men gay or straight can rape,gender_cb,gender_cb,gender_cb
self genociadal self serving liars,religion_cb,ethnicity_cb,religion_cb
im still that weird girl you bullied in high school so dont try it now,age_cb,age_cb,age_cb
medication compliance and organization tips im a year old female diagnosed in and i have always had struggles with facing the beast of medications organizing them and seeing it all in front of me gets so overwhelming i just dont even picking them up from the pharmacy is a lot to handle sometimes that i wait to pick them up or if at all whether its for my adhd bipolar pain management rx vitamins its always an internal struggle the cognitive dissonance between knowing im actively making the decision to not take them and knowing i want to get better is a difficult thing to face i dont know how to make it click or how to start ive heard this is unfortunately a common occurrence for people with my particular diagnosis if you have organizational advice or advice on a mentality switch please advise,bipolar,bipolar,bipolar
the bullies were another case starting from school to tuition centers then street omg how did i survive all of this how ill write chapters about it all but would rather cut it short happy birthday and god bless you,age_cb,age_cb,age_cb
this high percentage of girls who are bullied is similar to what i have found and is much higher than statistics from more traditional studies in bullying,age_cb,age_cb,age_cb
dont be surprisedevery terrorist act that isishezbollahal qaedamuslim brotherhoodthe list goes on and on is justified in the quranamerica wake up study the quran learn what their religion thinks about us nonbelieversespecially jews and christians and apostates,religion_cb,religion_cb,religion_cb
feeling suicidal for no reasoni just feel suicidal and i cant think of a reason why ive been feeling okay for the past few weeks and the thoughts just came back out of the blue does it ever permanently go away,suicide,suicide,suicide
my experience christian leaders who really live by the message of radical grace same ones who support christians like us theyre usually the ones who talk about their own sin in the pulpit a lot big sins amp frequently ask people to forgive them only radical grace does that,religion_cb,religion_cb,religion_cb
going to see a doctor today hey guys this is my first post here i have come to realise that my marriage is falling apart last week i have asked rrelationshipadvice a short while ago asking for advice on how to deal with the mother in law link here amp following the advice i received i tried on multiple occasions to talk to the wife but she wont have any of it and wont talk about it she said that im the one with the problem and that i need to get over myself and accept her being a part of our life amp the past twothree weeks i have been feeling empty nothing i just plough on on autopilot when my wife asks me why im grumpy i tell her that she knows why she just rolls her eyes amp thing is we have a kid there is no situation in which i end up happy if i leave my wife i lose everything and dont get to see my kid much amp i drive minutes to work and minutes back every day i enjoy the drive it helps me relax and listen to my music today however lappel du vide called to me i started thinking about how life would be simpler for everyone if i just slipped the mortgage would be paid off my wife would get a hefty payoff the mother in law will be happy to continue i am at work so i didnt do anything stupid amp the only thing that keeps me happy right now is my kid one year old light in the darkness that is my life amp i called my general practice surgery and i have an appointment at today they will probably feed me pills and tell me things will get better we will see amp sorry for the long drawn out post just trying to express how i feel i guess i just feel like sharing,suicide,suicide,suicide
my father was diagnosed with stage prostate cancer and while its wellcontrolled the side effects of his hormonal and chemo treatments have left him far more emotional but at least unable to just sublimate his depressionanxiety into anger and vent it at any available target anymore and the physical side effects have forced him into an early retirement meaning of the time hes home and sitting in the livingroom hes no longer directing the same vitriol and venom at me that he used to and neither does my sister but its all the little things they do to invalidate my feelings treating more like a livein servant than a family member and the occasional outbursts if they get angryupset that trigger me badly its making me lose ground lose progress and im having more and more trouble coping with everyday life and im afraid im going to just break crumble under the weight of it all,stress,stress,stress
were you born as an idiot or did u achieve it recently open ur eyes and see how these muslims are harassing women of their own community for buying things from hindu shops,religion_cb,religion_cb,religion_cb
seeing your friend be subjected to homophobia and gay jokes after filing a report with police about his rape,gender_cb,gender_cb,gender_cb
