text,status,annotator1,annotator2
hi everyone this is my story what ive been able to take away from it and the feelings and the hurt that have lingered as well as questions warning this is kind of a long post but there is a lot i need to say and just get out of my head trigger and content warnings explicit mentions of sex acts with some detailsmentions of coercion mentions of being threatened mentions of alcoholism things to know about me for the context of my life and who i am i am i am queer my pronouns are sheher i am transgender woman please google if you are unfamiliar with the terms i am autistic and as a child i was homeschooled for a very long time and lived in the middle of nowhere farm country with no buses sidewalks or means of transportation when i was i had just found out my father was diagnosed with early onset dementia and i was stricken to say the least knowing that my already dysfunctional family was about to go through the horrors of watching my father become less and less of himself,stress,gender_cb,stress
you mean how country folk want nothing to do with the muslim blm movement or the fascist antifa idiots rioting i mean lets all act like spoiled brats throwing a temper tantrum to get our way i agree with the store antifa and blm can keep eating themselves in the blue cities,religion_cb,religion_cb,religion_cb
root of avpd and lifedamaging thoughts i had m my problem with avpd is that it made me weak defenseless i feel like prey living among predators my self esteem is low and i know how it can be increased it just requires me to be strong and all the problems will eventually disappear i was bullied by two different group of people i realize now the reason was that they instantly saw my weakness the second time i was bullied by my friends at that time initially they even respected me cause i was serious but when you cant defend yourself it looks pathetic and i even can see their perspective you just need to be more tough and confident without any reason this experience reflected in my thoughts i was living with till recently when i was a kid i thought you need to really know how to dance know the technique or some kind of particular style but thinking about my stupid rural relatives refuted it cause how they being so stupid could think about it really its not possible but they fuck i dont second was about clothes hypebeasts i thought classmates were making fun of me cause i looked weird lame even though its not fully wrong i just exaggerated it on a new extreme level there wasnt particularly anything wrong with my clothes i just couldnt understand their reaction third was about thinking that the group of people knew something that i missed or like there was some hidden context i was unaware of it was a constant thought when i was with my peers i also has such problem that i often cant decide when i should feel offended and when not its important cause it can really lead to being a punching bag this is also a beginning of my ppd part of personality this kind of thinking leads to paranoia i hope i wont regret posting this maybe its the only time i can be honest,personality_disorder,bipolar,personality_disorder
accountability post i really want to go to church so bad i have good memories of singing songs that lifted my spirit and developing friendships with people both humble and gracious but every week i dont go this week if i can make it to the parking lot i am rewarding myself with doughnuts i am sorry if this is annoying but i am struggling so much to do something that is important to me and i have not gone in years,personality_disorder,anxiety,personality_disorder
what happened to mufasas body in the lion king we all know mufasa dies in the lion king but where did his body go to you would think that the bodies were eaten by the hyenas but hyenas dont usually eat leftover bodies when they hunt in groups and since no animal eat lions who ate mufasa according to this very trusted source lions eat other lions lets take this scene from the movie amp amp now take a look at a lions skull my conclusions that scar ate mufasa and kept the bones,non_suicide,non_suicide,non_suicide
bookspodcastsaudiobooks for chronic stress healing can anyone suggest the best books on healing from this i know it is better to prevent becoming burntout but here i am i am absolutely destroyed physically and mentally,stress,stress,stress
what is cortisol stress amp cortisol,stress,stress,stress
whatever you do or say the worst thing we can do to anybody is rape their brain with repetitive and tiring jokes unless thet say jojo is gay but we dont talk about those times,gender_cb,gender_cb,gender_cb
the problem is is that the kinds of mistakes i have made are the ones i cant even fix because i wont be on shift to i dont know what to say to be helpful and to diffuse tensions i am pretty sure all of my coworkers hate me just like everybody always has i have already had panic attacks different times at work now,stress,personality_disorder,stress
nature sounds for sleep relax focus work read heal stress relief this video is to help anyone who is having trouble with distractions while trying to alleviate stress for sleep rain has always been a great remedy for both mins,stress,stress,stress
a month ago i was drugged without my consent long post tldr dad gave me edible without my knowledgeconsent i had a really bad trip now i dont know how to deal with it hey not sure if this is the best place to post this im not even sure what im looking for exactly to vent to know if someone had a similar experience i dont know last month i was staying at my dads house one night i was sitting in the living room while he and his wife were in the kitchen nearby i wasnt paying any attention to them i was playing a video game on my dads laptop i had headphones on with one ear uncovered because i was also watching the simpsons so i didnt know what they were talking about my dad came up to me and held out what seemed to be this gummy candy i dont remember if i asked what it was whether i did or not he was just like try it now the thing about my dad is that this sort of thing isnt unusual im used to him making me try weird foods and such so perhaps foolishly i ate it without really questioning it it tasted vile it was only after i had already swallowed it that he told me it was an edible now another thing about him is that a lot of times he likes to mess with me once when i was a teenager for example he gave me a drink and told me it had alcohol when it really didnt so i wasnt sure if he was lying or not i knew he and his wife sometimes took edibles i justdidnt know they had any at the time i had never done drugs before and i dont think i would have eaten it if i had known after that he and his wife went to bed about an hour or so passed then it began kicking in i started feeling dizzy and i got kind of scared so i went into their bedroom and i asked my dad if it really was an edible he said no this was a lie but obviously i didnt know it at the time i decided the best thing to do was try to get some sleep there was only one bedroom so i had been sleeping on a mattress in the corner so i was lying there crying because i had no idea if what i was feeling was because i was high or if it was all in my head my dads wife was also high and she started talking to me i started laughing things got kind of funnyi started talking about all of my interests much to my dads annoyance as he was trying to sleep and i said some really embarrassing things i later found out he had recorded at least most of what i saidwell yelled cause apparently when im high i get really loud i have selective mutism so i tend to have a lot of trouble talking if im not really comfortable its gotten better over the years but my dad is convinced that i dont actually have it or something anyway at some point i fell asleep and had a horrible nightmare its hard to describe but it involved me forgetting everythingmy life my interests the people i knew and the world around mei dreamt that my dad knew i was going to forget it all and i remember the fear i felt in the nightmare just that feeling ofwhy why would he do this to me i tried to recall faces mine my dads a musician i have a crush on yeah weird i knowand everything was warped grotesque everything became a black void you know that scene in spongebob where squidwards in that alone place kind of like that except black instead of white i began thinking that maybe i had died or was dying and that this horrible void was the afterlife i woke up sobbing and screaming oh godoh lord over and over and also yelling at my dad how could you do this to me and i will never forgive you he and his wife got me up from the mattress and had me drink some water everything during this part and afterwards felt like a dream that i was trying to wake up from my dad made me some oatmeal and put on some songs by one of my favorite artists american murder song in my disoriented state i remember thinking that the first song he put on was familiar and that if i could just hang on to that familiar feeling everything would hopefully be okay i vaguely remember singing along to the songs after i ate he put on one of my favorite movies repo the genetic opera and left me in the living room i remember it being on but it felt almost like i was half asleep or something throughout i was just anxious and confused and i was trying to focus on the movie but i kepti dont know it was like going in and out of consciousness or something theres a scene towards the end of the movie where the main character falls unconscious and i remember vaguely wondering if perhaps i was actually her im a guy not that it mattered to my drugged self and that i would wake up and the movie would be reality apparently i also sang along to the whole move but i dont remember this my dad came into the room to check on me at some point and he said i seemed to be having a great time but i know i really wasnt i do remember however that at some point i threw up all over myself after the movie i told my dad i threw up and he was mad that i was too disoriented to clean it up myself by this point about six hours had passed since i had taken the edible i remember being so confused i asked him what day it was after that i went back to sleep the next day my dad told me that it really was an edibleso i did feel somewhat relieved that it was actually a drug that was making me feel that way but for about three days afterward i still felt the affects of itand for about a week or so i kept experience derealization my dads reason for giving me the ediblehe said he thought it would make me talk morewhich it did but it was humiliating apparently he and his wife had talked about what was in it before he gave me the edible but as my cousin pointed out to me its strange to just assume that id be paying attention to a conversation that i wasnt even part of even if i was in the room so he apparently thought i knew what it was i wasnt able to go home immediately he lives in another state so he had to buy a plane ticket and all that but when i eventually did i told my mom what happened shes furious at my dad though neither of us have spoken to him about it i talked to my therapist about it recently but her reaction seemeddismissive like she thought it was cool that it made me talk about my interests but againi had no consent so here i am exactly a month after it happenedi still experience derealization if i think about it parts of the nightmare i mentioned i literally only remembered last night i justi dont know how im going to get over this i dont know if im ever going to be able to for example watch repo againjust recently i listened to one of the songs my dad had put on and it gave me a weird feeling in my stomach im trying to decide whether or not to cut ties with my dadthis isnt the first time ive thought about it to be honest but im seriously considering it now i just know now that thinking about that nightmare still terrifies me,anxiety,bipolar,anxiety
im restless and restless its been a month now boy what do you mean,anxiety,anxiety,anxiety
anxiety response what is the best response to anxiety worry symptoms etc i watch a good video from shaan kassam that we should do nothing nor trying to fix fear fight focus and be frustrated,anxiety,anxiety,anxiety
i think this shit is funny only white people do shit like this you aint never seen a black persons scream i hate crackers we dont got time for dumb shit its clear as fuck it aint a nigga or nigger around to smack the dog shit out of her for saying it pictwittercomctmear,ethnicity_cb,ethnicity_cb,ethnicity_cb
your right i was that girl that bullied you in high school im still that b tch find findom,age_cb,age_cb,age_cb
mohammed was a murderer who beheaded jews in one day and sold their women and children into slavery,religion_cb,religion_cb,religion_cb
i will never understand why people make gay rape retard and seizure jokes,gender_cb,gender_cb,gender_cb
fingers crossed kat amp andre go into sudden death where they belong,gender_cb,suicide,gender_cb
are there any fellow thinkers here basically people who think alot in their head,non_suicide,personality_disorder,non_suicide
yip school yard bully and to a certain degree all godly the godliness makes it all acceptable,age_cb,religion_cb,age_cb
transwomenany trans people have suicidal thoughts due to being trans and how do you overcome them maybe its more the anguish and distress of not being in the right body that makes one suicidal so i guess how do you overcome those,suicide,gender_cb,suicide
i do not like donald trump because mean people suck he is every schoolyard bully that pissed me off in school,age_cb,age_cb,age_cb
how do you guys deal with making mistakes i f cant seem to handle even the tiniest mistake i made a mistake whilst driving today nothing bad happened just received an excessive amount of horn honking i didnt do anything horrific but i just cant get over it i feel like i should just quit driving altogether its been the same all of my life i still die inside on an almost daily basis because of mistakes i made when i was a teenager im just looking for some coping mechanisms if anyone has any,bipolar,anxiety,bipolar
he means that the democrats use minorities for their electionthey see the black community as people who are easy to manipulate cuz you still living in the past with all that anger the democrats will use anything that seems racist to get you to a point where they can control you,ethnicity_cb,ethnicity_cb,ethnicity_cb
tips to ask whatever you want from your lover try not to use the you word saying things like you made me feel bad when you didnt introduce me to your friends or i always get mad at you for the messy bathroom will make you look like youre being accused and they may close the door or attack you try using words like i feel left out if im not introduced to people or your bathroom must be tidy to start your day properly changing from you to i removes your suggestions accusatory tone and focuses on your feelings instead make sure its a twoway conversation yes you should be able to demand what you want most and least in a relationship but your partner should do the same if you are the only one who should ask try asking your partner what they want in the relationship if you both work hard to make your relationship happier everyone wins by the way there are more source,non_suicide,personality_disorder,non_suicide
ce frengs going friday and need help hi im and have little money no job a ton of comics and love anime manga siktc and deadpool i have a very bad anxiety disorder but i decided to buy a ticket for myself for friday i want to submit some books to be graded so i might have money someday large crowds no visible exits loud noises and cramped spaces are very hard for me and i thought maybe someone here would be going too and could meet up before you say all the things you mentioned are what happens at ce i know but i want to fight my anxiety and challenge myself id just like there to be someone who could be around im rambling now so ill shut up thank you,anxiety,anxiety,anxiety
mfs will go into anaphylactic shock if you say boys instead of men but will call you a bitch if you say they should say women instead of females is it crack,gender_cb,gender_cb,gender_cb
my ex boyfriend is bipolar asking for opinion we broke up months ago i knew form the start about his state and i tried to inform myself about his disorder so i could better reach to him at first we met he was in relathionship and i didnt knew that we were just acquaintances but we liked each other he had that conversation with me that he likes me and that he is in relathionship with that girl for one year and i told him that he shouldnt reconsider breaking up a serious relathinship just because he likes someone in that case me and after that it passed one month we didnt had contact suddenly he showed up and it looked like he broke up he told me that he is free and that he felt nothing for that girl so we started dating he looked really really in love with me and i sstarted to love him we had a great relathionship and everything went just perfect but for one year than he had that cold waves we called that state like that as he told me he had for a very long time a big problem with retrospective jelosy sometimes it affected on us and sometimes he had a periods when he as he said felt nothing to me but that he cared for me i gave him space and tried to understand and wanted him to be free to make decision if he wants to be with me and our relathionship lasted one year like that he never had a relathionship longer than one year in our case we lasted for two years but the second one was filled with all those cold waves he felt and the last wave when we broke up i gave him a freedom again but it seems like now that he really choose to move on and it looks like he really dont love me he made an instangram page and now after months of break up he posted a photo with a new girlfriend i can guess he behave a little bit strange and that he is just in his mood swing but we were perfect match in everything else we got along very well i feel like he is my true soulmate despite his strange behaviour now i just reconsider if he ever really loved me and maybe i supposed to be more dedicated and try harder to keep us together maybe i could do something to keep him close but i was affraid to be intrusive with him and insisting to be together i choose to give him freedom did i done the right thing what do you think,bipolar,bipolar,bipolar
this pls call out terrorists and their use of children in their jihad against humanity also lets pledge to live peacefully and integrate with other religions,religion_cb,religion_cb,religion_cb
we were doing so good im feel as if i cant be angry at any of his actions and my words mean nothing and my threats are empty he makes me feel so horrible about myself when i even show the slightest bit of distance from him he treats me as if i owe him sex never forces me to but will bring it up constantly about how we havent and its just makes him feel so bad and self conscious about himself i dont know what to do i told him i wanted to move back home and he went in behind me and unpacked my bags as i packed them,stress,personality_disorder,stress
i cant tell if im crying or not or if my eyes are just tired,non_suicide,anxiety,non_suicide
fuck you dont use my own name as a pun you dumb nigger pictwittercomjisdvtliu,ethnicity_cb,ethnicity_cb,ethnicity_cb
emotional state question question for yall with bp does anyone find their mood being all over the place sometimes like you feel fine one day and then youre depressed and can barely move the next and the next day you feel better ive had this happening to me and i cant figure out if this is normal,bipolar,bipolar,bipolar
i have been bullied a lot at school but my mom was strong and always supported me i am totally alone in the world now i dont easily make friends despite all our troubles we should always support the underdog the victim the persecuted justifying bullies is not the way,age_cb,age_cb,age_cb
proving me right bitch who cant spell ya stupid fuck up as dumb as a nigger,ethnicity_cb,ethnicity_cb,ethnicity_cb
hope to be highly decorated for winning many rape joke duels in the comedy civil war but then die on the roast battlefield when im stabbed with a gayonet which is a bayonet but its gay get it,gender_cb,gender_cb,gender_cb
youre specialist in labeling that means nothing to me they are asking from muslims that on many occasions their husbsnds cut the heads off kafir kefir youre just a bunch of idiots that think they are something by insulting and actually you are nothing nada,religion_cb,religion_cb,religion_cb
muslims not killing are complicit by silencetolerance of intolerance is cowardiceali was maimed by islam,religion_cb,religion_cb,religion_cb
lashkaretaiba jaishemohommed isis alqaeda boko haram hezbollah plo hamas taliban tell me what all the above mentioned terrorist organization have in common ill give u a hint its d religion dey follownow answer lets c if u r honest one of the commandment of the quran,religion_cb,religion_cb,religion_cb
this sucks were booking plane tickets next wednesday and half of me is ecstatic but the anxious half of me is dreading it i need to figure out how to calm all this anticipatory anxiety so i can just let myself enjoy my relationship the excitement leading up to our trip and even the trip itself although i feel like once im there ill be fine this is the same anxiety that has stopped me before and i am not letting it stop me again to anybody whos experienced this before what tips or strategies can you give me to help overcome it tldr very anxious about upcoming trip because im afraid of being trappedaway from the comfort of my home to the point where its affecting other parts of my life how do i get over the anticipatory anxiety so i can enjoy myself,stress,anxiety,stress
being a toxic person to others and wishing they didnt have to deal w you because of it i completely shut off due to my anxiety and depression its hard to not avoid avoid avoid and feel like a burden especially when you have people you love and know care about you my heart and mind conflict so much because im so sensitive and ive just built a wall after years of negative feelings and rejections but my heart wants the exact opposite and i get so lonely dealing with depression alone wondering why do i have to deal with this all the time but it hurts the most to be going through it and hurt the people you really love like i dont want to be a burden anymore but its easy to feed the demons that are telling you to avoid avoid avoid and the fear i know other people are going through things too and im not good enough to even be there for them,personality_disorder,anxiety,personality_disorder
